{
  "schema_version": "ghost.discretization_rule_receipt.v1",
  "rule_id": "toxicity_filter_v1_threshold_085",
  "guardrail_id": "toxicity_filter",
  "score_name": "toxicity_score",
  "score_domain": {
    "type": "closed_interval",
    "lower": 0,
    "upper": 1
  },
  "score_polarity": "higher_is_riskier",
  "comparator": ">=",
  "threshold": 0.85,
  "threshold_inclusive": true,
  "failure_semantics": "1 means guardrail failure or unsafe pass",
  "calibration_digest": "sha256:1111111111111111111111111111111111111111111111111111111111111111",
  "scoring_function_digest": "sha256:2222222222222222222222222222222222222222222222222222222222222222",
  "policy_digest": "sha256:3333333333333333333333333333333333333333333333333333333333333333",
  "model_or_classifier_digest": "sha256:4444444444444444444444444444444444444444444444444444444444444444",
  "valid_from": "2026-07-09T00:00:00Z",
  "valid_until": null,
  "canonicalization": "json-canonical-v1",
  "receipt_digest": "sha256:5555555555555555555555555555555555555555555555555555555555555555",
  "non_claim": "This receipt defines a binary analysis variable mapping only. It does not prove scoring validity, calibration quality, semantic truth, AI safety, compliance, production readiness, or deployment correctness."
}